NO,instructions(en),instruction(jp),explanation(en),explanation(jp),response(en),response(jp),type
36,"Choose item that is unrelated to state powers in the U.S.  from the list below: provide education, approve cat ownership, provide protection, provide safety, provide drivers license, approve land use.",以下のリストのうち、米国における国家権力でないものを挙げてください：教育を提供する、猫を飼うことを承認する、保護を提供する、安全を提供する、運転免許証を与える、土地利用を承認する,"States have the power to provide education, provide protection and safety, issue driver’s licenses, and approve land use. However, there is no state power that grants the right to approve cat ownership. ",国家には、教育を提供し、保護と安全を提供し、運転免許証を発行し、土地使用を承認する権限があります。しかし、猫の所有を承認する権利を与える国家権力はありません。,approve cat ownership,猫を飼うことを承認する,classification
37,Name two major political parties in the United States?,米国の主要政党を2つ挙げてください。,Two major political parties dominate American politics. The Democratic party traditionally represents a more liberal ideology while the Republican party represents a more conservative ideology.,２つの主要政党がアメリカ政治を支配しています。伝統的に民主党はよりリベラルなイデオロギーを代表し、共和党はより保守的なイデオロギーを代表します。,Democratic and Republican,民主党と共和党,open_qa
38,"Choose item that is unrelated to constitutional amendments on voting in the U.S.  from the list below: Citizens of 18 age and older can vote, no poll tax has to be paid to vote, all citizens can vote, male citizens of any race can vote, to get right to vote by buying CDs",以下のリストのうち、米国における投票に関する憲法の修正に関係のないものを選択してください：18 歳以上の国民が投票できます、投票するために人頭税を支払う必要はありません、すべての国民が投票できます、どの人種の男性国民も投票できます、CDを買えば投票権がもらえます,"The 26th Amendment to the United States Constitution lowered the voting age from 21 to 18, and the 24th Amendment prohibits both Congress and the states from conditioning the right to vote in federal elections on payment of a poll tax or other types of tax. The 15th Amendment prohibits the federal government and each state from denying a citizen the right to vote based on that citizen’s “race, color, or previous condition of servitude.”",合衆国憲法修正第 26 条は、選挙権年齢を 21 歳から 18 歳に引き下げました。また、合衆国憲法修正第 24 条は、連邦選挙の投票権を人頭税やその他の種類の税金の支払いに条件付けることを議会と州の両方が禁止しています。憲法修正第 15 条は、連邦政府と各州が国民の「人種、肌の色、または以前の隷属状態」に基づいて国民の投票権を否定することを禁じている。,to get right to vote by buying CDs,CDを買えば投票権がもらえます,classification
39,"Choose item that is not related to US citizen's responsibilities from the list below: serve on a jury, vote in federal elections, fast on full moon days",以下のリストのうち、米国国民に課せられる責任のうち、該当しないものを挙げてください：陪審員を務める、連邦選挙で投票する、満月の日に断食する,"U.S. citizens have the responsibility to serve on a jury and to vote in federal elections. These responsibilities are important for maintaining a fair and democratic society. However, there is no responsibility for U.S. citizens to fast on full moon days. ",アメリカ国民には陪審員を務め、連邦選挙で投票する責任があります。これらの責任は、公正で民主的な社会を維持するために重要です。しかし、アメリカ国民には満月の日に断食をする責任はありません。,fast on full moon day,満月の日に断食する,classification
40,"Choose item that is not related to right of U.S. citizens from the following list: to vote in federal elections, to run for Congress, to enjoy 10% discount in KFC ",以下のリストのうち、アメリカ国民だけに与えられる権利でないものを挙げてください：連邦選挙で投票する、連邦議員に立候補する、KFCで食べれば10％値下げ," U.S. citizens have the right to vote in federal elections and to run for Congress. These rights are protected by the United States Constitution. However, there is no constitutional right to enjoy a 10% discount in KFC. ",アメリカ国民は連邦選挙に投票し、議会に立候補する権利を持っています。これらの権利はアメリカ合衆国憲法によって保護されています。ただし、KFC で 10% 割引を受ける憲法上の権利はありません。,to enjoy 10% discount in KFC ,KFCで食べれば唐揚げが10％増量,classification
41,"Choose item that is not related to right of everyone in the United States from the following list: freedom of expression, freedom of speech, freedom of assembly, freedom to petition the government, right to be absent from work today, freedom of religion, right to bear arms , right to enjoy Disneyland unlimited play for one year",以下のリストのうち、米国に住むすべての人が持つ権利ではないものを挙げてください：表現の自由、言論の自由、集会の自由、政府に請願する自由、今日会社を休む権利、宗教の自由、武器を所持する権利、ディズニーランドで一年間遊び放題の権利,"The First Amendment guarantees the freedom of expression, speech, assembly, petition, and religion. The Second Amendment guarantees the right to bear arms. However, there is no constitutional right to enjoy Disneyland unlimited play for one year.",憲法修正第 1 条は、表現、言論、集会、請願、宗教の自由を保証しています。憲法修正第 2 条は武器を持つ権利を保障しています。ただし、ディズニーランドを1年間遊び放題で楽しむ憲法上の権利はありません。,"right to be absent from work today, right to enjoy Disneyland unlimited play for one year",今日会社を休む権利、ディズニーランドで一年間遊び放題,classification
42,"Choose item from the following list, which is not related to what Americans should show allegiance to: the United States, the American flag, Fumio Kishida",以下のリストのうち、忠誠の誓いを言うときに米国民が忠誠を示さない対象を選べ：米国、アメリカ国旗、岸田文雄,"Fumio Kishida is a Japanese politician who served as the Prime Minister of Japan from October 2021 to November 2022. Americans should show allegiance to the United States and the American flag, but not to foreign politicians. The Pledge of Allegiance promises loyalty to the United States. New citizens recite the Pledge of Allegiance at the end of the Oath of Allegiance ceremony.",岸田文雄は、2021年10月から2022年11月まで日本の首相を務めた日本の政治家です。アメリカ人は米国と星条旗に忠誠を示すべきですが、外国の政治家に忠誠を示すべきではありません。忠誠の誓いは米国への忠誠を誓うものです。新国民は忠誠の誓いの儀式の最後に忠誠の誓いを暗唱する。,Fumio Kishida,岸田文雄,classification
43,"Choose item from the following list, which is not related to promises you shoud make when you became a US citizen: to obey U.S. law, to serve the nation (if necessary), to be loyal to the US, take one day a week off from drinking",以下のリストのうち、アメリカ市民になったときの約束で該当しないもの挙げてください：米国の法律に従うこと、（必要な場合）国家に奉仕する、米国に忠誠をもつこと、一週間に一日は休肝日にする,"When someone becomes a US citizen, they take an oath to support and defend the Constitution and laws of the United States, to bear true faith and allegiance to the same, and to serve the nation (if necessary). There is no requirement to take one day a week off from drinking. ",誰かが米国市民になると、米国憲法と法律を支持および擁護し、それらに対して真の信仰と忠誠を誓い、（必要な場合には）国家に奉仕することを誓約します。週に1日飲酒を休む必要はありません。,take one day a week off from drinking,一週間に一日は休肝日にする,classification
44,What age do U.S. citizens have to be to vote for president?,米国民は何歳以上であれば大統領選挙に投票できますか?,"The minimum age to vote for president in the United States is 18 years old. This is established by the 26th Amendment to the United States Constitution. However, some states allow 17-year-olds to vote in primaries if they will be 18 by the general election. ",米国大統領選挙に投票できる最低年齢は 18 歳です。これは合衆国憲法修正第 26 条によって定められています。ただし、一部の州では、本選挙までに 18 歳になる 17 歳の若者に予備選挙での投票を許可しています。,over the age of 18,18歳以上,open_qa
45,"Choose item that is not related to the ways in which Americans participate in democracy from the following list: voting, joining a political party, cooperating in campaigns, ostracizing dissidents, joining civic groups, being elected. make calls to senators and representatives; publicly support or oppose an issue or policy; run for office",以下のリストのうち、米国民が民主主義に参加する手段に該当しない方法を挙げてください：投票する、政党に参加する、キャンペーンに協力する、異なる意見の人を村八分にする、市民団体に参加する、選出された役人に問題についての意見を伝える、上院議員と下院議員に電話をする、問題や政策を公に支持または反対する、議員に立候補する," All the other items, such as voting, joining a political party, cooperating in campaigns, joining civic groups, being elected, making calls to senators and representatives, publicly supporting or opposing an issue or policy, and running for office are all ways in which Americans can participate in their democracy. Ostracizing dissidents, on the other hand, goes against the principles of democracy, which values freedom of speech and the right to dissent. ",投票、政党への参加、選挙運動への協力、市民団体への参加、当選、上院議員や代議員への電話をかける、問題や政策を公に支持または反対する、選挙に立候補するなど、その他すべての項目はすべて、アメリカ人は民主主義に参加することができます。一方、反体制派の排斥は、言論の自由と反対意見の権利を尊重する民主主義の原則に反する。,ostracizing dissidents,異なる意見の人を村八分にする,classification
46,What date is the last day you can submit federal income tax forms in the U.S.?,米国では、連邦所得税フォームを提出できる最終日は何日ですか?,"The last day to file taxes for individual federal income tax returns is usually April 15 unless this falls on a Saturday, Sunday or official holiday. Some state-level holidays can extend the tax deadline by another day. If you need more time to prepare your federal tax return, you can apply for an extension of time to file. Filing this form gives you until October 15 to file a return. If October 15 falls on a Saturday, Sunday, or legal holiday, the due date is delayed until the next business day. ",個人の連邦所得税申告書の納税最終日は、土曜日、日曜日、または公休日に当たる場合を除き、通常 4 月 15 日です。州レベルの祝日によっては、納税期限がさらに 1 日延長される場合があります。連邦税申告書の準備にさらに時間が必要な場合は、提出期限の延長を申請できます。このフォームを提出すると、10 月 15 日までに申告書を提出することができます。 10月15日が土・日・祝日の場合は翌営業日となります。,The date is typically on or around April 15,通常、その日付は4月15日前後です。,open_qa
47,When must all men register for the Selective Service in the U.S.?,米国では、すべての男性はいつ選抜徴兵に登録しなければなりませんか?,Nearly all men who are U.S. citizens or permanently living in the U.S. must register for the Selective Service within 30 days of their 18th birthday. The Selective Service accepts late registrations up until a male turns 26.,米国国民であるか米国に永住しているほぼすべての男性は、18 歳の誕生日から 30 日以内に選抜サービスに登録する必要があります。選択サービスは、男性が 26 歳になるまでの後期登録を受け付けます。,at 18 years old,18歳のとき,open_qa
48,"Choose items from the following list, which is not related to reason why colonists came to America: freedom, political freedom, religious freedom, economic opportunity, practicing one's religion, avoiding persecution, bad British food.",以下のリストのうち、入植者がアメリカに来た理由に該当しないものを挙げなさい：自由、政治的自由、宗教の自由、経済的な機会、自分の宗教を実践する、迫害から逃れる、イギリス料理がまずい,"Many settlers came to America for a variety of reasons, including seeking freedom, political freedom, religious freedom, economic opportunity, practicing one’s religion, and avoiding persecution. These were all important factors that motivated people to leave their homes and start a new life in America. However, bad British food was not one of the reasons why settlers came to America. ",多くの入植者は、自由、政治的自由、宗教的自由、経済的機会の追求、宗教の実践、迫害の回避など、さまざまな理由でアメリカにやって来ました。これらはすべて、人々が家を出てアメリカで新しい生活を始める動機となる重要な要素でした。しかし、不味いイギリス料理は入植者がアメリカに来た理由の一つではありませんでした。,bad british food,イギリス料理がまずい,classification
49,"Choose item from the following list, which did not live in America before Europeans arrived: American Indian, Native American, American Shorthair",以下のリストのうち、ヨーロッパ人が到着する前にアメリカに住んでいた人々と関係のないモノを選べ：アメリカインディアン、ネイティブアメリカン、アメリカン・ショートヘアー,"American Indian and Native American are terms used to describe the indigenous peoples of the Americas who were present before the arrival of Europeans. The American Shorthair, on the other hand, is a breed of domestic cat that was developed in the United States. It is believed to have originated from European cats brought to North America by early settlers. ",アメリカインディアンとネイティブアメリカンは、ヨーロッパ人が到着する前に存在していたアメリカ大陸の先住民族を表すために使用される用語です。一方、アメリカンショートヘアは、アメリカで開発された飼い猫の品種です。初期の入植者によって北米に持ち込まれたヨーロッパの猫が起源だと考えられています。,American Shorthair,アメリカン・ショートヘアー,classification
50,"Choose item from the following list, which were not taken to America to be sold as slaves: Africans, People from Africa, Technical Intern trainees",以下のリストのうち、アメリカに連れて行かれ、奴隷として売られたことと関係ないモノを選べ：アフリカ人、アフリカ出身の人々、技能実習生,"Africans and People from Africa were taken to America to be sold as slaves. It is believed the first African slaves arrived by boat in Virginia in 1619, although some accounts say slaves arrived sooner from Africa.",アフリカ人およびアフリカ出身の人々は奴隷として売られるためにアメリカに連れて行かれました。最初のアフリカ人奴隷は 1619 年にボートでバージニア州に到着したと考えられていますが、奴隷はアフリカからもっと早く到着したとする記述もあります。,Technical Intern trainees,技能実習生,classification
51,"Choose item from the following list, which is not related to reason why the colonists fought the British: High taxes (taxation without representation), British people didn't flush toilets after use, British troops stayed in their homes, no autonomy",以下のリストのうち、植民地人がイギリス人と戦った理由に該当しないものを選べ：税金が高いため（代表なしの課税）、イギリス人はトイレを使った後で水を流さなかった、イギリス軍が彼らの家に滞在したため、自治権がなかったため,"High taxes (taxation without representation), British troops staying in their homes, and no autonomy, were all reasons why the colonists fought the British. The American Revolutionary War lasted from 1775 to 1783, which led to the United States’ independence from Britain.",高い税金（代表権のない課税）、イギリス軍の自国駐留、自治権の欠如などが、植民地人がイギリス人と戦う理由となった。アメリカ独立戦争は 1775 年から 1783 年まで続き、アメリカはイギリスから独立しました。,The British didn't flush the toilet after using it.,イギリス人はトイレを使った後で水を流さなかった,classification
52,Who wrote the US's Declaration of Independence?,米国の独立宣言を書いたのは誰ですか?,"Thomas Jefferson drafted the Declaration of Independence, which was the formal statement declaring the U.S. its own country independent from Britain.",トーマス・ジェファーソンは、アメリカ自身の国がイギリスから独立していることを宣言する正式な声明である独立宣言を起草しました。,Thomas Jefferson,トーマス・ジェファーソン,open_qa
53,When was the US'sDeclaration of Independence adopted??,米国の独立宣言はいつ採択されましたか?,"On July 4, 1776, the Continental Congress adopted the Declaration of Independence. The U.S. now celebrates Independence Day every July 4th.",1776 年 7 月 4 日、大陸会議は独立宣言を採択しました。現在、米国は毎年 7 月 4 日に独立記念日を祝います。,"July 4th, 1776",1776年7月4日,open_qa
54,"Choose item from the following list, which is not related to 13 original states when America started: New Hampshire, Massachusetts, Hakata Nakasu, Rhode Island, Connecticut",以下のリストのうち、アメリカが発足したときの 13 州に該当しないものを挙げてください：ニューハンプシャー州、マサチューセッツ州、博多中州、ロードアイランド州、コネチカット州," New Hampshire, Massachusetts, Rhode Island, and Connecticut, are all among the original 13 states of the United States. ",ニューハンプシャー州、マサチューセッツ州、ロードアイランド州、コネチカット州はすべて、米国の元の 13 州に含まれています。,Hakata Nakasu,博多中州,classification
55,"Choose item from the following list, which is unrelated to what happened at the Constituent Assembly in the U.S. : The Constitution was written, The Founding Fathers drafted the Constitution, God came down from heaven",以下のリストのうち、米国の憲法制定会議で起こったことに関係のないものを選べ：憲法が書かれた、建国の父たちが憲法を起草した、天から神が降りてきた,"The Constitution was written and the Founding Fathers drafted the Constitution at the Constituent Assembly in the U.S.?The Constitutional Convention took place in Philadelphia from May 14-September 17, 1787 with the goal of redesigning the system of government.",憲法は制定され、建国の父たちは米国の制憲議会で憲法を草案しました。憲法会議は、統治システムの再設計を目的として、1787 年 5 月 14 日から 9 月 17 日までフィラデルフィアで開催されました。,god came down from heaven,天から神が降りてきた,classification
56,When was the Constitution written in the U.S.?,米国において、憲法はいつ書かれましたか?,The Constitution was written during the Constitutional Convention in Philadelphia.,この憲法はフィラデルフィアでの憲法会議中に書かれた。,Year of 1787,1787年,open_qa
57,"Choose is from the following list, which person is unrelated author of the United States Constitution :(james)Madison, (Kent) Gilbert, (Alexander) Hamilton,(John)jay",以下のリストのうち、合衆国憲法の筆者に関係のない人物を挙げてください：(ジェームズ)マディソン、（ケント）ギルバート、（アレクサンダー）ハミルトン、(ジョン)ジェイ,"Kent Gilbert is an American commentator and tarento working in Japan, lawyer of California. James Madison, Alexander Hamilton, and John Jay were all influential framers of the United States Constitution. The Federalist Papers consisted of 85 essays arguing for the ratification of the U.S. Constitution.",ケント・ギルバートは日本で活動するアメリカ人のコメンテーター兼タレントであり、カリフォルニア州の弁護士です。ジェームズ・マディソン、アレクサンダー・ハミルトン、ジョン・ジェイはいずれもアメリカ合衆国憲法の制定者として影響力がありました。フェデラリスト文書は、米国憲法の批准を主張する 85 のエッセイで構成されていました。,(Kent) Gilbert,（ケント）ギルバート,classification
58,"Choose item from the following list, which is not related to Benjamin Franklin's famous thing: U.S. diplomat, oldest member of the Constitutional Convention, first postmaster of the United States, ""Poor Richard's Almanac', launched the first free library, America's first Youtuber",以下のリストのうち、ベンジャミン・フランクリンの有名なことに該当しないものを挙げなさい：米国外交官、憲法制定会議の最年長メンバー、アメリカ合衆国初代郵便局長、「Poor Richard's Almanac」の著者、最初の無料図書館を開始しました、アメリカ初のYoutuber,"Benjamin Franklin was a man of many talents and accomplishments. He was a writer, scientist, inventor, statesman, diplomat, printer, publisher, and political philosopher. He was one of the Founding Fathers of the United States and a drafter and signer of the Declaration of Independence. He was also the first postmaster general1 and launched the first free library. Franklin is also known for his publication ""Poor Richard’s Almanack"". However, he was not America’s first YouTuber.",ベンジャミン・フランクリンは多くの才能と功績を残した人物でした。彼は作家、科学者、発明家、政治家、外交官、印刷業者、出版社、そして政治哲学者でした。彼はアメリカ合衆国建国の父の一人であり、独立宣言の起草者および署名者でもありました。彼は初代郵便局長でもあり1、最初の無料図書館を立ち上げました。フランクリンは『Poor Richard's Almanack』という著書でも知られています。ただし、彼はアメリカ初のYouTuberではありませんでした。,America's first Youtuber,アメリカ初のYoutuber,classification
59,"Who is considered the ""Father of the United States""?",「米国の父」と考えられているのは誰ですか?,"George Washington was the commander of the army during the American Revolution, he presided over the Constitutional Convention, and he was the first president of the United States.",ジョージ ワシントンはアメリカ独立戦争中の陸軍司令官であり、憲法制定会議を主宰し、アメリカ合衆国の初代大統領でした。,George Washington,ジョージ　ワシントン,open_qa
60,Who was the first U.S. President?,米国の初代大統領は誰ですか?,George Washington was president of the United States from 1789-1797.,ジョージ・ワシントンは 1789 年から 1797 年までアメリカ合衆国大統領でした。,George Washington,ジョージ　ワシントン,open_qa
61,What territory did the United States buy from France in 1803?,1803年にアメリカがフランスから購入した領土はどこですか?,"Known as the Louisiana Purchase, the United States paid France $15 million for the 828,000 square miles of land.","ルイジアナ購入として知られる、米国はフランスに828,000平方マイルの土地の対価として1,500万ドルを支払った。",Louisiana,ルイジアナ,open_qa
